wosarticle__ti,wosarticle__py,wosarticle__doc,wosarticle__di,docproject__relevant,redirect_url
Indicators and tools for assessing sustainability impacts of the forest bioeconomy,2017.0,1337179,http://dx.doi.org/10.1186/s40663-017-0089-8,Yes (1),https://forestecosyst.springeropen.com/articles/10.1186/s40663-017-0089-8
Uranium from Africa - An overview on past and current mining activities: Re-appraising associated risks and chances in a global context,2017.0,1372078,http://dx.doi.org/10.1016/j.jafrearsci.2016.12.004,Yes (1),https://linkinghub.elsevier.com/retrieve/pii/S1464343X16304022
Climate-neutral and sustainable campus Leuphana University of Lueneburg,2017.0,1526961,http://dx.doi.org/10.1016/j.energy.2017.08.039,Yes (1),https://linkinghub.elsevier.com/retrieve/pii/S0360544217314172
"Green, circular, bio economy: A comparative analysis of sustainability avenues",2017.0,1601301,http://dx.doi.org/10.1016/j.jclepro.2017.09.053,Yes (1),https://linkinghub.elsevier.com/retrieve/pii/S0959652617320425
"Towards zero climate emissions, zero waste, and one planet living - Testing the applicability of three indicators in Finnish cities",2017.0,1634404,http://dx.doi.org/10.1016/j.spc.2017.02.004,Yes (1),https://linkinghub.elsevier.com/retrieve/pii/S2352550917300118
"Understanding consumers' renewable energy behaviour beyond ""homo economicus"": An exploratory survey in four European countries",2017.0,1673166,http://dx.doi.org/10.1109/EEM.2017.7981932,Yes (1),https://ieeexplore.ieee.org/document/7981932/
Determination of biomass content in combusted municipal waste and associated CO2 emissions in Estonia,2017.0,1824390,http://dx.doi.org/10.1016/j.egypro.2017.09.059,Yes (1),https://linkinghub.elsevier.com/retrieve/pii/S1876610217339036
Decades of EU energy policy: towards politically driven markets,2017.0,5339611,http://dx.doi.org/10.1093/jwelb/jwx027,Yes (1),https://academic.oup.com/jwelb/article-abstract/10/5/380/4563549?redirectedFrom=fulltext
Elicitation formats and the WTA/WTP gap: A study of climate neutral foods,2016.0,212015,http://dx.doi.org/10.1016/j.foodpol.2016.03.001,Yes (1),https://linkinghub.elsevier.com/retrieve/pii/S0306919216300057
Carbon balance for wood production from sustainably managed forests,2016.0,219132,http://dx.doi.org/10.1016/j.biombioe.2016.05.025,Yes (1),https://linkinghub.elsevier.com/retrieve/pii/S0961953416301799
Selection and prioritization of mitigation measures to realize climate neutral operation of a water cycle company,2016.0,281539,http://dx.doi.org/10.2166/wcc.2015.026,Yes (1),https://iwaponline.com/jwcc/article-abstract/7/1/29/1954/Selection-and-prioritization-of-mitigation?redirectedFrom=fulltext
Determining national greenhouse gas emissions from waste-to-energy using the Balance Method,2016.0,668713,http://dx.doi.org/10.1016/j.wasman.2016.01.025,Yes (1),https://linkinghub.elsevier.com/retrieve/pii/S0956053X16300253
Crossing the chasm in Dutch greenhouse horticulture: the case of the New Cultivation concept,2016.0,1852364,http://dx.doi.org/10.17660/ActaHortic.2016.1132.10,Yes (1),https://www.actahort.org/books/1132/1132_10.htm
Climate Neutrality - Towards An Ethical Conception of Climate Neutrality,2016.0,2559768,http://dx.doi.org/10.1080/21550085.2016.1226241,Yes (1),https://www.tandfonline.com/doi/full/10.1080/21550085.2016.1226241
Forest Products Markets under Change: Review and Research Implications,2016.0,2616507,http://dx.doi.org/10.1007/s40725-016-0042-z,Yes (1),https://link.springer.com/article/10.1007/s40725-016-0042-z
Can we produce carbon and climate neutral forest bioenergy?,2015.0,54881,http://dx.doi.org/10.1111/gcbb.12134,Yes (1),
Anaerobic digestates lower N2O emissions compared to cattle slurry by affecting rate and product stoichiometry of denitrification - An N2O isotopomer case study,2015.0,106329,http://dx.doi.org/10.1016/j.soilbio.2015.01.021,Yes (1),https://linkinghub.elsevier.com/retrieve/pii/S0038071715000334
Biomass Energy and Climate Neutrality: The Case of the Northern Forest,2015.0,363682,http://dx.doi.org/10.3368/le.91.2.197,Yes (1),http://le.uwpress.org/content/91/2/197
Natural gas as a marine fuel,2015.0,560173,http://dx.doi.org/10.1016/j.enpol.2015.08.027,Yes (1),https://linkinghub.elsevier.com/retrieve/pii/S0301421515300665
Students as change agents in a town-wide sustainability transformation: the Oberlin Project at Oberlin College,2015.0,702746,http://dx.doi.org/10.1016/j.cosust.2015.07.005,Yes (1),https://linkinghub.elsevier.com/retrieve/pii/S187734351500069X
Zero emission targets as long-term global goals for climate protection,2015.0,725505,http://dx.doi.org/10.1088/1748-9326/10/10/105007,Yes (1),"https://validate.perfdrive.com/?ssa=ca92f3cc-05b1-4ff5-92b0-2ec43bdb20d1&ssb=24508277772&ssc=https%3A%2F%2Fiopscience.iop.org%2Farticle%2F10.1088%2F1748-9326%2F10%2F10%2F105007&ssi=6ba5e6db-8427-4510-843d-a9834b12b997&ssk=support@shieldsquare.com&ssm=21430434619576054102964670292779&ssn=ab8d5721e7a3c38a4a21ae1283162b0a798c4e2f1e85-57c5-4aa0-a20239&sso=8ababc3d-f4b629e128620dab4b1acb998fbabb41b237f20fd7b92206&ssp=05781524801654077440165409600953179&ssq=63239341305061433750513050864315866984730&ssr=MTQ1LjI1My4xMTAuMjE4&sst=Mozilla/5.0%20(X11;%20Linux%20x86_64)%20AppleWebKit/537.36%20(KHTML,%20like%20Gecko)%20Chrome/101.0.4951.64%20Safari/537.36&ssv=&ssw=&ssx=W10="
Economic and environmental assessment of liquefied natural gas as a supplemental aircraft fuel,2014.0,587342,http://dx.doi.org/10.1016/j.paerosci.2013.12.002,Yes (1),https://linkinghub.elsevier.com/retrieve/pii/S0376042113000900
A climate of change: A transition approach for climate neutrality in the city of Ghent (Belgium),2014.0,679497,http://dx.doi.org/10.1016/j.scs.2013.06.001,Yes (1),https://linkinghub.elsevier.com/retrieve/pii/S2210670713000395
"Achieving profitable, productive climate-neutral Swedish agriculture",2014.0,714941,http://dx.doi.org/10.5367/oa.2014.0182,Yes (1),
"Net environmental impacts of low-share wood pellet co-combustion in an existing coal-fired CHP (combined heat and power) production in Helsinki, Finland",2014.0,717460,http://dx.doi.org/10.1016/j.energy.2014.09.068,Yes (1),https://linkinghub.elsevier.com/retrieve/pii/S0360544214011268
Aerosol radiative forcing from the 2010 Eyjafjallajokull volcanic eruptions,2014.0,1438732,http://dx.doi.org/10.1002/2014JD021977,Yes (1),
Greening University Campus Buildings to Reduce Consumption and Emission While Fostering Hands-on Inquiry-Based Education,2014.0,1666263,http://dx.doi.org/10.1016/j.proenv.2014.03.036,Yes (1),https://linkinghub.elsevier.com/retrieve/pii/S1878029614000371
Global energy storage demand for a 100% renewable electricity supply,2014.0,1855041,http://dx.doi.org/10.1016/j.egypro.2014.01.154,Yes (1),https://linkinghub.elsevier.com/retrieve/pii/S1876610214001702
Climate-neutrality versus carbon-neutrality for aviation biofuel policy,2013.0,128181,http://dx.doi.org/10.1016/j.trd.2013.03.013,Yes (1),https://linkinghub.elsevier.com/retrieve/pii/S136192091300062X
The role of forest residues in the accounting for the global warming potential of bioenergy,2013.0,238347,http://dx.doi.org/10.1111/gcbb.12014,Yes (1),
The use of life cycle assessment for evaluating the sustainability of the Amsterdam water cycle,2013.0,372071,http://dx.doi.org/10.2166/wcc.2013.007,Yes (1),https://iwaponline.com/jwcc/article-abstract/4/2/103/3618/The-use-of-life-cycle-assessment-for-evaluating?redirectedFrom=fulltext
"The ""New Urban Europe"": Global Challenges and Local Responses in the Urban Century",2013.0,497367,http://dx.doi.org/10.1080/09654313.2012.716243,Yes (1),https://www.tandfonline.com/doi/abs/10.1080/09654313.2012.716243
Time-dependent climate impact of a bioenergy system - methodology development and application to Swedish conditions,2013.0,574427,http://dx.doi.org/10.1111/gcbb.12031,Yes (1),
N2O fluxes of a bio-energy poplar plantation during a two years rotation period,2013.0,604278,http://dx.doi.org/10.1111/gcbb.12019,Yes (1),
Efficacy of LEED-certification in reducing energy consumption and greenhouse gas emission for large New York City office buildings,2013.0,654413,http://dx.doi.org/10.1016/j.enbuild.2013.08.032,Yes (1),https://linkinghub.elsevier.com/retrieve/pii/S037877881300529X
Effects of digestate from anaerobically digested cattle slurry and plant materials on soil microbial community and emission of CO2 and N2O,2013.0,721227,http://dx.doi.org/10.1016/j.apsoil.2012.09.003,Yes (1),https://linkinghub.elsevier.com/retrieve/pii/S0929139312002260
Climate change mitigation by recovery of energy from the water cycle: a new challenge for water management,2012.0,134985,http://dx.doi.org/10.2166/wst.2011.820,Yes (1),https://iwaponline.com/wst/article-abstract/65/1/135/15727/Climate-change-mitigation-by-recovery-of-energy?redirectedFrom=fulltext
Towards a climate neutral water cycle,2012.0,362619,http://dx.doi.org/10.2166/wcc.2012.015,Yes (1),https://iwaponline.com/jwcc/article-abstract/3/3/163/3553/Towards-a-climate-neutral-water-cycle?redirectedFrom=fulltext
Biogas from renewable electricity - Increasing a climate neutral fuel supply,2012.0,648910,http://dx.doi.org/10.1016/j.apenergy.2011.07.024,Yes (1),https://linkinghub.elsevier.com/retrieve/pii/S0306261911004697
Biological treatment options for cyanobacteria metabolite removal - A review,2012.0,1527376,http://dx.doi.org/10.1016/j.watres.2011.11.018,Yes (1),https://linkinghub.elsevier.com/retrieve/pii/S0043135411006907
Usage of Biomass for Energetic Conversion,2011.0,426569,http://dx.doi.org/10.1002/cite.201100124,Yes (1),
CO2 emissions from biomass combustion for bioenergy: atmospheric decay and contribution to global warming,2011.0,738095,http://dx.doi.org/10.1111/j.1757-1707.2011.01102.x,Yes (1),
"Envisioning carbon capture and storage: expanded possibilities due to air capture, leakage insurance, and C-14 monitoring",2009.0,156932,http://dx.doi.org/10.1007/s10584-009-9632-0,Yes (1),https://link.springer.com/article/10.1007/s10584-009-9632-0
"Fischer-Tropsch diesel production in a well-to-wheel perspective: A carbon, energy flow and cost analysis",2009.0,423826,http://dx.doi.org/10.1016/j.enconman.2009.01.008,Yes (1),https://linkinghub.elsevier.com/retrieve/pii/S0196890409000041
Life cycle assessment of wood-based heating in Norway,2009.0,518771,http://dx.doi.org/10.1007/s11367-009-0086-4,Yes (1),https://link.springer.com/article/10.1007/s11367-009-0086-4
Palm oil and the emission of carbon-based greenhouse gases,2008.0,509148,http://dx.doi.org/10.1016/j.jclepro.2006.07.054,Yes (1),https://linkinghub.elsevier.com/retrieve/pii/S0959652606003593
Hazardous waste incineration in context with carbon dioxide,2008.0,568468,http://dx.doi.org/10.1177/0734242X07082339,Yes (1),
European Union waste management strategy and the importance of biogenic waste,2007.0,141460,http://dx.doi.org/10.1007/s10163-007-0178-9,Yes (1),https://link.springer.com/article/10.1007/s10163-007-0178-9
A Norwegian perspective on buildings and climate change,2007.0,494853,http://dx.doi.org/10.1080/09613210701269438,Yes (1),https://www.tandfonline.com/doi/abs/10.1080/09613210701269438
Intermittent renewable energy: The only future source of hydrogen?,2007.0,541248,http://dx.doi.org/10.1016/j.ijhydene.2006.12.008,Yes (1),https://linkinghub.elsevier.com/retrieve/pii/S036031990600615X
Frameworks and communication: Perspectives in tackling the climate change challenge for energy supply,1999.0,1854004,http://dx.doi.org/10.1016/B978-008043018-8/50082-5,Yes (1),https://linkinghub.elsevier.com/retrieve/pii/B9780080430188500825
CO2 removal and fixation solar high temperature syngas generation for fuel synthesis,1997.0,271909,http://dx.doi.org/10.1016/S0196-8904(96)00298-1,Yes (1),https://linkinghub.elsevier.com/retrieve/pii/S0196890496002981
Social discounting of orthogonal capital flow rates,1997.0,1399644,http://dx.doi.org/10.1016/S0360-3199(96)00215-7,Yes (1),https://linkinghub.elsevier.com/retrieve/pii/S0360319996002157
ON THE EVALUATION OF HALOCARBON RADIATIVE FORCING AND GLOBAL WARMING POTENTIALS,1995.0,564077,http://dx.doi.org/10.1029/94JD02516,Yes (1),
